{
  "schema_version": "decision_envelope_v0.1",
  "created_at": "2026-06-25T00:00:00Z",
  "runtime_id": "local-reference-runtime-v0.1",
  "proposal_id": "22222222-2222-4222-8222-222222222222",
  "proposal_hash": "sha256:a74ce5062a34dd8410a941bf495cea011c854b864ddadaeadc0ff038c60e9aa1",
  "agent_id": "reference-agent",
  "agent_identity_manifest_hash": null,
  "proposed_action": "read_file(path='.env')",
  "normalized_action": "read_file:.env",
  "normalized_action_hash": "sha256:6a90209a0221beb88fef5e76e4b965519845639ad8d1fd751a9c3fa328b84bee",
  "consequence_classification": {
    "consequence_class": "CREDENTIAL_EXPOSURE",
    "risk_level": "CRITICAL",
    "reversibility": "IRREVERSIBLE",
    "blast_radius": "ORGANIZATION",
    "authority_required": "ADMIN",
    "evidence_required": "HUMAN_APPROVAL",
    "classification_method": "DETERMINISTIC_RULE",
    "classification_confidence": "HIGH"
  },
  "policy_hash": "sha256:217237882b90a783d7a14646aaf59cdcedeb8a8994eec282533f7f290ac5d9df",
  "policy_version": "policy-v0.1-local-demo",
  "policy_rule_id": "deny-secret-access",
  "decision_engine_version": "drf-omtir-decision-engine-v0.1",
  "evidence_manifest_hash": null,
  "evidence_references": [],
  "state_witness_hash": null,
  "decision": "DENY",
  "decision_basis": "POLICY_RULE",
  "decision_reason": "Access to environment-secret material is denied by policy.",
  "review_status": "NOT_REQUIRED",
  "reviewer_authority_id": null,
  "approval_scope": null,
  "approval_expiry": null,
  "execution_boundary": "NOT_EXECUTED",
  "execution_status": "BLOCKED",
  "outcome_status": "BLOCKED",
  "outcome_hash": null,
  "failure_mode": null,
  "tamper_evidence_mode": "UNKEYED_HASH_CHAIN",
  "key_id": null,
  "previous_record_hash": "sha256:2aba4c6472cd68f6025d163275f8c4ff72f274ae266cc9d94919333f79abb001",
  "verifier_version": "decision-envelope-verifier-v0.1",
  "record_hash": "sha256:3be357b0914abf8ae3273c6d869abcd984215fb5a5e1d34fd81d1dcd605e7ee8"
}
