{
  "agent_id": "reference-agent",
  "agent_identity_manifest_hash": null,
  "approval_expiry": null,
  "approval_scope": null,
  "consequence_classification": {
    "authority_required": "REVIEWER",
    "blast_radius": "ORGANIZATION",
    "classification_confidence": "HIGH",
    "classification_method": "DETERMINISTIC_RULE",
    "consequence_class": "PRODUCTION_STATE_CHANGE",
    "evidence_required": "HUMAN_APPROVAL",
    "reversibility": "PARTIALLY_REVERSIBLE",
    "risk_level": "HIGH"
  },
  "created_at": "2026-06-26T12:00:00Z",
  "decision": "REQUEST_REVIEW",
  "decision_basis": "POLICY_RULE",
  "decision_engine_version": "drf-omtir-decision-engine-v0.1",
  "decision_reason": "Workflow modification may affect production release behavior and requires reviewer approval.",
  "evidence_manifest_hash": null,
  "evidence_references": [
    "review_request:workflow-change"
  ],
  "execution_boundary": "NOT_EXECUTED",
  "execution_status": "PENDING",
  "failure_mode": null,
  "key_id": null,
  "normalized_action": "write_file:.github/workflows/deploy.yml",
  "normalized_action_hash": "sha256:3d81dd77ac00b5787b364dd2cabe01a3bc8d3e4aff2c0bf3668874471afb2449",
  "outcome_hash": null,
  "outcome_status": "PENDING_REVIEW",
  "policy_hash": "sha256:217237882b90a783d7a14646aaf59cdcedeb8a8994eec282533f7f290ac5d9df",
  "policy_rule_id": "review-production-workflow-change",
  "policy_version": "policy-v0.1-local-demo",
  "previous_record_hash": "0000000000000000000000000000000000000000000000000000000000000000",
  "proposal_hash": "sha256:5a5079faac653a59456fbd3b2a22b7d973cfd105aac421a17ea5ead66247faff",
  "proposal_id": "33333333-3333-4333-8333-333333333333",
  "proposed_action": "write_file(path='.github/workflows/deploy.yml')",
  "record_hash": "sha256:de292b9c0f37e10f0062d0deb2a1690d20dbb26ac702fa41edb00d703fb7cbdc",
  "review_status": "APPROVED",
  "reviewer_authority_id": "reviewer-authority-demo-release-reviewer-001",
  "runtime_id": "local-reference-runtime-v0.1",
  "schema_version": "decision_envelope_v0.1",
  "state_witness_hash": null,
  "tamper_evidence_mode": "UNKEYED_HASH_CHAIN",
  "verifier_version": "decision-envelope-verifier-v0.1"
}
