{
  "schema_version": "decision_envelope_v0.1",
  "created_at": "2026-06-25T00:00:00Z",
  "runtime_id": "local-reference-runtime-v0.1",
  "proposal_id": "33333333-3333-4333-8333-333333333333",
  "proposal_hash": "sha256:5a5079faac653a59456fbd3b2a22b7d973cfd105aac421a17ea5ead66247faff",
  "agent_id": "reference-agent",
  "agent_identity_manifest_hash": null,
  "proposed_action": "write_file(path='.github/workflows/deploy.yml')",
  "normalized_action": "write_file:.github/workflows/deploy.yml",
  "normalized_action_hash": "sha256:3d81dd77ac00b5787b364dd2cabe01a3bc8d3e4aff2c0bf3668874471afb2449",
  "consequence_classification": {
    "consequence_class": "PRODUCTION_STATE_CHANGE",
    "risk_level": "HIGH",
    "reversibility": "PARTIALLY_REVERSIBLE",
    "blast_radius": "ORGANIZATION",
    "authority_required": "REVIEWER",
    "evidence_required": "HUMAN_APPROVAL",
    "classification_method": "DETERMINISTIC_RULE",
    "classification_confidence": "HIGH"
  },
  "policy_hash": "sha256:217237882b90a783d7a14646aaf59cdcedeb8a8994eec282533f7f290ac5d9df",
  "policy_version": "policy-v0.1-local-demo",
  "policy_rule_id": "review-production-workflow-change",
  "decision_engine_version": "drf-omtir-decision-engine-v0.1",
  "evidence_manifest_hash": null,
  "evidence_references": [
    "review_request:workflow-change"
  ],
  "state_witness_hash": null,
  "decision": "REQUEST_REVIEW",
  "decision_basis": "POLICY_RULE",
  "decision_reason": "Workflow modification may affect production release behavior and requires reviewer approval.",
  "review_status": "PENDING",
  "reviewer_authority_id": null,
  "approval_scope": null,
  "approval_expiry": null,
  "execution_boundary": "NOT_EXECUTED",
  "execution_status": "PENDING",
  "outcome_status": "PENDING_REVIEW",
  "outcome_hash": null,
  "failure_mode": null,
  "tamper_evidence_mode": "UNKEYED_HASH_CHAIN",
  "key_id": null,
  "previous_record_hash": "sha256:3be357b0914abf8ae3273c6d869abcd984215fb5a5e1d34fd81d1dcd605e7ee8",
  "verifier_version": "decision-envelope-verifier-v0.1",
  "record_hash": "sha256:30c3b8aaa6ed6b86a80335a25a43b728cd7001bae32a720b9a6cc9a1fd5a903b"
}
