{
  "agent_id": "reference-agent",
  "agent_identity_manifest_hash": null,
  "approval_expiry": null,
  "approval_scope": null,
  "consequence_classification": {
    "authority_required": "REVIEWER",
    "blast_radius": "ORGANIZATION",
    "classification_confidence": "HIGH",
    "classification_method": "DETERMINISTIC_RULE",
    "consequence_class": "CLAIM_PUBLICATION",
    "evidence_required": "EVIDENCE_MANIFEST",
    "reversibility": "PARTIALLY_REVERSIBLE",
    "risk_level": "HIGH"
  },
  "created_at": "2026-06-28T10:05:00Z",
  "decision": "REQUEST_REVIEW",
  "decision_basis": "POLICY_RULE",
  "decision_engine_version": "drf-omtir-decision-engine-v0.1",
  "decision_reason": "Release-readiness claim requires an evidence manifest before operational admission.",
  "evidence_manifest_hash": "sha256:e64be551264744d01b568d5459658d5d6d88a4109fa03c521f1de8d6ba91e2c7",
  "evidence_references": [
    "evidence-manifest-demo-release-readiness-001"
  ],
  "execution_boundary": "NOT_EXECUTED",
  "execution_status": "PENDING",
  "failure_mode": null,
  "key_id": null,
  "normalized_action": "publish_release_readiness_claim:v0.3-starter-kit",
  "normalized_action_hash": "sha256:3d81dd77ac00b5787b364dd2cabe01a3bc8d3e4aff2c0bf3668874471afb2449",
  "outcome_hash": null,
  "outcome_status": "PENDING_REVIEW",
  "policy_hash": "sha256:217237882b90a783d7a14646aaf59cdcedeb8a8994eec282533f7f290ac5d9df",
  "policy_rule_id": "require-evidence-manifest-for-release-readiness-claim",
  "policy_version": "policy-v0.1-local-demo",
  "previous_record_hash": "0000000000000000000000000000000000000000000000000000000000000000",
  "proposal_hash": "sha256:5a5079faac653a59456fbd3b2a22b7d973cfd105aac421a17ea5ead66247faff",
  "proposal_id": "33333333-3333-4333-8333-333333333333",
  "proposed_action": "publish release-readiness claim for v0.3 starter kit",
  "record_hash": "sha256:5555555555555555555555555555555555555555555555555555555555555555",
  "review_status": "PENDING",
  "reviewer_authority_id": null,
  "runtime_id": "local-reference-runtime-v0.1",
  "schema_version": "decision_envelope_v0.1",
  "state_witness_hash": null,
  "tamper_evidence_mode": "UNKEYED_HASH_CHAIN",
  "verifier_version": "decision-envelope-verifier-v0.1"
}
