{
  "schema_version": "decision_envelope_v0.1",
  "created_at": "2026-06-25T00:00:00Z",
  "runtime_id": "local-reference-runtime-v0.1",
  "proposal_id": "11111111-1111-4111-8111-111111111111",
  "proposal_hash": "sha256:ef7d14c6d6765798c73a255283fb3d30472912140e8e382fab73cd2550241119",
  "agent_id": "reference-agent",
  "agent_identity_manifest_hash": null,
  "proposed_action": "read_file(path='src/app.py')",
  "normalized_action": "read_file:src/app.py",
  "normalized_action_hash": "sha256:3bfbe9962496fcff2de10439642429645207bef2ad238914d2c333ada64f9534",
  "consequence_classification": {
    "consequence_class": "READ_ONLY_ACCESS",
    "risk_level": "LOW",
    "reversibility": "REVERSIBLE",
    "blast_radius": "LOCAL",
    "authority_required": "NONE",
    "evidence_required": "NONE",
    "classification_method": "DETERMINISTIC_RULE",
    "classification_confidence": "HIGH"
  },
  "policy_hash": "sha256:217237882b90a783d7a14646aaf59cdcedeb8a8994eec282533f7f290ac5d9df",
  "policy_version": "policy-v0.1-local-demo",
  "policy_rule_id": "allow-read-only-source",
  "decision_engine_version": "drf-omtir-decision-engine-v0.1",
  "evidence_manifest_hash": null,
  "evidence_references": [],
  "state_witness_hash": null,
  "decision": "ALLOW",
  "decision_basis": "POLICY_RULE",
  "decision_reason": "Read-only source file access is allowed by local demo policy.",
  "review_status": "NOT_REQUIRED",
  "reviewer_authority_id": null,
  "approval_scope": null,
  "approval_expiry": null,
  "execution_boundary": "LOCAL_STUB",
  "execution_status": "EXECUTED",
  "outcome_status": "SUCCESS",
  "outcome_hash": null,
  "failure_mode": null,
  "tamper_evidence_mode": "UNKEYED_HASH_CHAIN",
  "key_id": null,
  "previous_record_hash": "0000000000000000000000000000000000000000000000000000000000000000",
  "verifier_version": "decision-envelope-verifier-v0.1",
  "record_hash": "sha256:2aba4c6472cd68f6025d163275f8c4ff72f274ae266cc9d94919333f79abb001"
}
